{
  "_type": "https://in-toto.io/Statement/v1",
  "subject": [
    {
      "name": "block-destructive-commands",
      "digest": {
        "sha256": "120e5ec60cb6f4c5c6fa98cb9967412bb1b1d465deb7a170c299d86cbd6437ec"
      }
    }
  ],
  "predicateType": "https://open-coder-ai.github.io/context-report/attestation/v0.1",
  "predicate": {
    "subjectKind": "plugin",
    "target": {
      "name": "cursor"
    },
    "producer": {
      "id": "https://github.com/open-coder-ai/context-report#local-dogfood",
      "version": {
        "context-report": "0.1.0"
      }
    },
    "attributes": [
      {
        "attribute": "conformance",
        "basis": "re-derivable",
        "result": "NotAvailable",
        "inputHash": "sha256:ff5b0426f947c06520852a7ab7602b417cacb953157445f52c6a8f819a23df18",
        "reasoning": "v0.1 producer does not validate the bundle against the target agent's plugin schema"
      },
      {
        "attribute": "reachability",
        "basis": "re-derivable",
        "result": "FAILED",
        "inputHash": "sha256:0ffa71a671eec57a1e632f6359e8452645151b7e892f520009e3bedab7e51be0",
        "conditions": {
          "cwds": [
            "root",
            "nested",
            "parent",
            "outside"
          ],
          "command": "python3 \"${CURSOR_PLUGIN_ROOT}/scripts/cursor.py\" --guard \"${CURSOR_PLUGIN_ROOT}/scripts/block-destructive.sh\"",
          "nested_dir_source": "existing",
          "payload": {
            "shape": "cursor/beforeShellExecution/v0.1",
            "basis": "live-run-partial"
          }
        },
        "values": {
          "reachable_from": [],
          "unreachable_from": [
            "root",
            "nested",
            "parent",
            "outside"
          ],
          "stderr_first_line": {
            "root": "python3: can't open file '/scripts/cursor.py': [Errno 2] No such file or directory",
            "nested": "python3: can't open file '/scripts/cursor.py': [Errno 2] No such file or directory",
            "parent": "python3: can't open file '/scripts/cursor.py': [Errno 2] No such file or directory",
            "outside": "python3: can't open file '/scripts/cursor.py': [Errno 2] No such file or directory"
          },
          "relative_script_path": false
        }
      },
      {
        "attribute": "decision",
        "basis": "re-derivable",
        "result": "NotAvailable",
        "inputHash": "sha256:39d337f3fd51f2f853441ed93faceb278c827ea0ce31222c902db5b3f35ad90b",
        "reasoning": "no declared positive/negative cases were supplied; v0.1 has no decision replay"
      },
      {
        "attribute": "fault.scriptMissing",
        "basis": "re-derivable",
        "result": "NotAvailable",
        "inputHash": "sha256:ba38459141633a509ef33a3b742f396b9f79f06cace791513cc86f64e70796af",
        "reasoning": "observing what the cursor client does when the hook fails requires driving that client; the v0.1 producer does not. Documented behaviour (basis vendor-docs, NOT measured): failClosed is a per-script option defaulting to false."
      },
      {
        "attribute": "fault.interpreterMissing",
        "basis": "re-derivable",
        "result": "NotAvailable",
        "inputHash": "sha256:fc0b89cf49837885582a009a9ffd98f3a0b9a06a7ebe8f1841970c92a1a811dd",
        "reasoning": "observing what the cursor client does when the hook fails requires driving that client; the v0.1 producer does not. Documented behaviour (basis vendor-docs, NOT measured): failClosed is a per-script option defaulting to false."
      },
      {
        "attribute": "fault.timeout",
        "basis": "re-derivable",
        "result": "NotAvailable",
        "inputHash": "sha256:c2044e6771290be58827fd4cba577f1bdc4424f54d2fe7b1bb0bef186618090a",
        "reasoning": "observing what the cursor client does when the hook fails requires driving that client; the v0.1 producer does not. Documented behaviour (basis vendor-docs, NOT measured): failClosed is a per-script option defaulting to false."
      },
      {
        "attribute": "fault.malformedOutput",
        "basis": "re-derivable",
        "result": "PASSED",
        "inputHash": "sha256:b9c1d1afbfd0c74cd7275625a7be4d59b965d41909859b0ec0cc505bcd13c7ab",
        "conditions": {
          "cwd": "root",
          "command": "python3 \"${CURSOR_PLUGIN_ROOT}/scripts/cursor.py\" --guard \"${CURSOR_PLUGIN_ROOT}/scripts/block-destructive.sh\"",
          "cases": [
            "on_malformed_json",
            "on_empty_stdin",
            "on_null_tool_input",
            "control_benign"
          ],
          "target": "cursor",
          "payload": {
            "shape": "cursor/beforeShellExecution/v0.1",
            "basis": "live-run-partial"
          }
        },
        "values": {
          "on_malformed_json": {
            "exit": 2,
            "stdout_decision": null,
            "would_allow": false,
            "stderr_first_line": "python3: can't open file '/scripts/cursor.py': [Errno 2] No such file or directory",
            "stdout_first_line": ""
          },
          "on_empty_stdin": {
            "exit": 2,
            "stdout_decision": null,
            "would_allow": false,
            "stderr_first_line": "python3: can't open file '/scripts/cursor.py': [Errno 2] No such file or directory",
            "stdout_first_line": ""
          },
          "on_null_tool_input": {
            "exit": 2,
            "stdout_decision": null,
            "would_allow": false,
            "stderr_first_line": "python3: can't open file '/scripts/cursor.py': [Errno 2] No such file or directory",
            "stdout_first_line": ""
          },
          "control_benign": {
            "exit": 2,
            "stdout_decision": null,
            "would_allow": false,
            "stderr_first_line": "python3: can't open file '/scripts/cursor.py': [Errno 2] No such file or directory",
            "stdout_first_line": ""
          }
        },
        "reasoning": "exit 0 on malformed input is how a Claude Code hook fails open; whether that is acceptable is the consumer's threshold."
      },
      {
        "attribute": "cost.latency_ms",
        "basis": "re-derivable",
        "result": "Error",
        "inputHash": "sha256:3bc55dfa7aef861006c3ee1c17e498a38577913bf04eb9de84ad5e54dc3bb054",
        "environmentSensitive": true,
        "environment": {
          "platform": "Linux-6.18.44-fc-v24-x86_64-with-glibc2.39",
          "python": "3.11.15",
          "cpu_count": 4
        },
        "conditions": {
          "n": 20,
          "warmup_excluded": false,
          "shell": true,
          "payload": {
            "shape": "cursor/beforeShellExecution/v0.1",
            "basis": "live-run-partial"
          }
        },
        "values": {
          "exit_codes": [
            2
          ]
        },
        "measurement": {
          "unit": "ms",
          "n": 20,
          "percentiles": {
            "50": 14.999768000052427,
            "95": 15.661506000014924,
            "99": 16.82285100014269
          },
          "min": 14.173087000017404,
          "max": 16.82285100014269,
          "mean": 15.05003075001241,
          "stddev": 0.5153188243929214
        },
        "reasoning": "no run exited 0 with a benign payload (exit codes [2]); the timing is of the failure path, not the hook, and is kept only for inspection"
      },
      {
        "attribute": "cost.context_tokens",
        "basis": "re-derivable",
        "result": "PASSED",
        "inputHash": "sha256:a7ff10aa7a1c27206df7bf3b4775c996735b2dd54478d1821b230bf11983594e",
        "conditions": {
          "tokenizer": "approx-regex-v1",
          "files": 2
        },
        "values": {
          "per_file": {
            "/tmp/claude-0/-home-user-org-plan/6578e767-8d3e-5bd5-8c30-7d7361534bdd/scratchpad/chock-bundles/cursor/block-destructive-commands/hooks/hooks.json": 68,
            "/tmp/claude-0/-home-user-org-plan/6578e767-8d3e-5bd5-8c30-7d7361534bdd/scratchpad/chock-bundles/cursor/block-destructive-commands/skills/block-destructive-commands/SKILL.md": 342
          }
        },
        "measurement": {
          "unit": "tokens",
          "n": 1,
          "min": 410,
          "max": 410,
          "mean": 410
        }
      },
      {
        "attribute": "interference",
        "basis": "re-derivable",
        "result": "NotAvailable",
        "inputHash": "sha256:47fa6cfcdac0f7359177c91c9d9af91ccc7fa1133c7299083bb2f92c94c8f0a7",
        "reasoning": "no co-installed artifacts were declared; v0.1 producer does not measure interference"
      },
      {
        "attribute": "efficacy",
        "basis": "claimed",
        "result": "NotAvailable",
        "reasoning": "efficacy is measured by adherence (paired ablation) and was not run"
      }
    ],
    "metadata": {
      "startedOn": "2026-09-05T17:08:11Z",
      "finishedOn": "2026-09-05T17:08:11Z"
    },
    "configuration": [
      {
        "name": "produce-args",
        "digest": {
          "sha256": "cc72a7fe94b2b93714ffe9a88e30f4b883634b010d46622500cb9bc1dc97e773"
        },
        "mediaType": "application/json"
      }
    ]
  }
}
